{
  "hasMore": false,
  "items": [
    {
      "contentHash": "sha256:aaaaaaaaaaaaaaaaaaaaaaaaaaaaaaaaaaaaaaaaaaaaaaaaaaaaaaaaaaaaaaaa",
      "providerIdentity": {
        "providerKey": "apollo-people-search",
        "providerSubjectId": "person-synthetic-123"
      },
      "record": {
        "datasetId": "dataset-synthetic-contacts",
        "recordId": "contact-synthetic",
        "values": [
          { "fieldId": "field-display-name", "value": "Synthetic Contact" }
        ],
        "workspaceId": "workspace-synthetic"
      }
    }
  ],
  "nextCursor": null,
  "sourcePartitionCompleted": true,
  "version": "1.0.0"
}
